{
  "schema_version": "0.1.0",
  "drawing_id": "3f6c1e2a-7b4d-4c8e-9a51-2d0f6b7e8c11",
  "drawing_hash": "sha256:6c9dda3baaab349f23a5e252894f2c1af55ec1757d221dc49adfeec9dffbcedb",
  "rev": "B",
  "mode": "draft",
  "check_run_id": "8b1d4f60-2c3a-4e7b-9f10-5a6c7d8e9f01",
  "profiles": [
    { "id": "gb-eng-residential", "name": "GB-ENG Residential", "version": "1.3.0", "layer": "jurisdiction", "tier": 1, "signer": { "name": "J. Smith", "credential": "CIAT 12345", "jurisdiction": "England", "verification_level": "verified" } },
    { "id": "generic", "name": "Generic", "version": "0.9.0", "layer": "generic", "tier": null, "signer": null }
  ],
  "checks": { "performed": 4, "passed": 1, "flagged": 3 },
  "checks_not_performed": ["fire stopping", "structural", "acoustic"],
  "unverified_objects": {
    "count": 1,
    "items": [{ "object_id": "ins_01", "note": "insulation type inferred" }]
  },
  "signed": {
    "signed": false,
    "signer": null,
    "basis_key": "stamp.unsigned",
    "audit_record_hash": null,
    "signed_at": null
  },
  "marks": ["watermark.free_tier"],
  "closing_sentence_key": "stamp.closing_sentence",
  "generated_at": "2026-09-14T14:02:00Z"
}
